[
  {
    "id": "852AA",
    "code": "852AA",
    "type": "store",
    "type_name": "順豐站",
    "type_name_en": "SF Store",
    "name": "大埔同茂坊順豐站",
    "name_en": "Tung Mau Square, Tai Po",
    "region": "新界",
    "region_en": "New Territories",
    "district": "大埔區",
    "district_en": "Tai Po District",
    "sub_district": "大埔",
    "sub_district_en": "Tai Po",
    "address": "香港大埔區大埔同茂坊1及3號北翼地鋪*",
    "address_en": "G/F, North Wing ,1 & 3 Tung Mau Square*,Tai Po,Tai Po District,Hong Kong",
    "telephone": "98160449",
    "business_hours": "周一至周六,09:00-20:00;周日及勞工假期,09:00-18:00",
    "business_hours_en": "Mon to Sat 09:00-20:00; Sun & Statutory Holidays 09:00-18:00",
    "location": {
      "latitude": 22.449009,
      "longitude": 114.167336
    },
    "source": "api_tc",
    "quality_flags": [],
    "provenance": {
      "name": "api_tc",
      "name_en": "api_en",
      "address": "api_tc",
      "address_en": "api_en",
      "district": "api_tc",
      "business_hours": "api_tc",
      "business_hours_en": "api_en"
    },
    "retrieved_at": "2026-10-26 11:46 (HKT UTC+8)"
  },
  {
    "id": "852AAL",
    "code": "852AAL",
    "type": "store",
    "type_name": "順豐站",
    "type_name_en": "SF Store",
    "name": "將軍澳茵怡花園順豐站",
    "name_en": "Verbena Heights, Tseung Kwan O",
    "region": "新界",
    "region_en": "New Territories",
    "district": "西貢區",
    "district_en": "Sai Kung District",
    "sub_district": "將軍澳",
    "sub_district_en": "Tseung Kwan O",
    "address": "香港西貢區將軍澳貿泰路8號茵怡花園第1座地下6號鋪*",
    "address_en": "Shop No. 6, G/F, Block 1, Verbena Heights, 8 Mau Tai Road*,Tseung Kwan O,Sai Kung District,Hong Kong",
    "telephone": "64635030",
    "business_hours": "周一至周五,10:30-22:00",
    "business_hours_en": "Mon to Fri 11:00-22:00; Sun & Public Holidays 12:00-20:00; Sat 12:00-20:00",
    "location": {
      "latitude": 22.322014,
      "longitude": 114.255703
    },
    "source": "api_tc",
    "quality_flags": [
      {
        "type": "SOURCE_TC_EN_STREET_NUMBER_CONFLICT",
        "severity": "warning",
        "fields": [
          "address",
          "address_en"
        ],
        "details": {
          "tc": "8",
          "en": "6, 8"
        }
      },
      {
        "type": "SOURCE_TC_EN_BUSINESS_HOURS_CONFLICT",
        "severity": "warning",
        "fields": [
          "business_hours",
          "business_hours_en"
        ],
        "details": {
          "tc": "周一至周五,10:30-22:00",
          "en": "Mon to Fri 11:00-22:00; Sun & Public Holidays 12:00-20:00; Sat 12:00-20:00"
        }
      }
    ],
    "provenance": {
      "name": "api_tc",
      "name_en": "api_en",
      "address": "api_tc",
      "address_en": "api_en",
      "district": "api_tc",
      "business_hours": "api_tc",
      "business_hours_en": "api_en"
    },
    "retrieved_at": "2026-10-26 11:46 (HKT UTC+8)"
  },
  {
    "id": "852AB",
    "code": "852AB",
    "type": "store",
    "type_name": "順豐站",
    "type_name_en": "SF Store",
    "name": "大埔美新里順豐站",
    "name_en": "Mei San Lane,Tai Po",
    "region": "新界",
    "region_en": "New Territories",
    "district": "大埔區",
    "district_en": "Tai Po District",
    "sub_district": "大埔",
    "sub_district_en": "Tai Po",
    "address": "香港大埔區大埔汀角路51A號太平工業大廈二座8樓A室*^",
    "address_en": "Shop A, G/F, No.5 Mei San Lane, Tai Po*,Tai Po,Tai Po District,Hong Kong",
    "telephone": "29611022",
    "business_hours": "周一至周六,09:00-20:00;周日及勞工假期,休息",
    "business_hours_en": "Mon to Sat 09:00-20:00; Sun & Statutory Holidays Closed",
    "location": {
      "latitude": 22.453145,
      "longitude": 114.164999
    },
    "source": "api_tc",
    "quality_flags": [
      {
        "type": "SOURCE_TC_EN_STREET_NUMBER_CONFLICT",
        "severity": "warning",
        "fields": [
          "address",
          "address_en"
        ],
        "details": {
          "tc": "51A",
          "en": "5"
        }
      },
      {
        "type": "SOURCE_FORMATTING_ARTIFACT",
        "severity": "info",
        "fields": [
          "address",
          "address_en"
        ],
        "details": {
          "pattern": "Contains caret (^) separator"
        }
      }
    ],
    "provenance": {
      "name": "api_tc",
      "name_en": "api_en",
      "address": "api_tc",
      "address_en": "api_en",
      "district": "api_tc",
      "business_hours": "api_tc",
      "business_hours_en": "api_en"
    },
    "retrieved_at": "2026-10-26 11:46 (HKT UTC+8)"
  },
  {
    "id": "852ABL",
    "code": "852ABL",
    "type": "store",
    "type_name": "順豐站",
    "type_name_en": "SF Store",
    "name": "將軍澳寶盈花園商場順豐站",
    "name_en": "Bauhinia Garden, Tseung Kwan O",
    "region": "新界",
    "region_en": "New Territories",
    "district": "西貢區",
    "district_en": "Sai Kung District",
    "sub_district": "將軍澳",
    "sub_district_en": "Tseung Kwan O",
    "address": "香港西貢區將軍澳唐俊街11號寶盈花園商場一樓S21-S21A號鋪*",
    "address_en": "Shop Nos. S21 & S21A on The First Floor of Commercial Centre, Bauhinia Garden, 11 Tong Chun Street*,Tseung Kwan O,Sai Kung District,Hong Kong",
    "telephone": "64635030",
    "business_hours": "周一至周五,11:00-21:00;周日及公眾假期,12:00-20:00; 周六,12:00-20:00",
    "business_hours_en": "Mon to Fri 11:00-21:00; Sun & Public Holidays 12:00-20:00; Sat 12:00-20:00",
    "location": {
      "latitude": 22.3069383,
      "longitude": 114.2617571
    },
    "source": "api_tc",
    "quality_flags": [],
    "provenance": {
      "name": "api_tc",
      "name_en": "api_en",
      "address": "api_tc",
      "address_en": "api_en",
      "district": "api_tc",
      "business_hours": "api_tc",
      "business_hours_en": "api_en"
    },
    "retrieved_at": "2026-10-26 11:46 (HKT UTC+8)"
  },
  {
    "id": "852ACL",
    "code": "852ACL",
    "type": "store",
    "type_name": "順豐站",
    "type_name_en": "SF Store",
    "name": "藍田匯景廣場順豐站",
    "name_en": "Sceneway Plaza, Lam Tin",
    "region": "九龍",
    "region_en": "Kowloon",
    "district": "觀塘區",
    "district_en": "Kwun Tong District",
    "sub_district": "藍田",
    "sub_district_en": "Lam Tin",
    "address": "香港觀塘區藍田匯景道8號匯景廣場3樓4A20-22號鋪*",
    "address_en": "Shop 4A20-22, 3/F , Sceneway Plaza, 8 Sceneway Road*,Lam Tin,Kwun Tong District,Hong Kong",
    "telephone": "55261667",
    "business_hours": "周一至周五,11:00-22:00;周日及公眾假期,12:00-20:00;周六,12:00-20:00",
    "business_hours_en": "Mon to Fri 11:00-22:00; Sun & Public Holidays 12:00-20:00; Sat 12:00-20:00",
    "location": {
      "latitude": 22.3069951,
      "longitude": 114.2335701
    },
    "source": "api_tc",
    "quality_flags": [],
    "provenance": {
      "name": "api_tc",
      "name_en": "api_en",
      "address": "api_tc",
      "address_en": "api_en",
      "district": "api_tc",
      "business_hours": "api_tc",
      "business_hours_en": "api_en"
    },
    "retrieved_at": "2026-10-26 11:46 (HKT UTC+8)"
  },
  {
    "id": "852AJL",
    "code": "852AJL",
    "type": "store",
    "type_name": "順豐站",
    "type_name_en": "SF Store",
    "name": "油塘大本型順豐站",
    "name_en": "Domain, Yau Tong",
    "region": "九龍",
    "region_en": "Kowloon",
    "district": "觀塘區",
    "district_en": "Kwun Tong District",
    "sub_district": "油塘",
    "sub_district_en": "Yau Tong",
    "address": "香港觀塘區油塘大本型2樓229號鋪*",
    "address_en": "Shop 229, 2/F, Domain*,Yau Tong,Kwun Tong District,Hong Kong",
    "telephone": "55261667",
    "business_hours": "周一至周五,11:00-21:00;周日及公眾假期,12:00-20:00; 周六, 12:00-20:00",
    "business_hours_en": "Mon to Fri 10:00-21:00; Sun & Public Holidays 12:00-20:00; Sat 12:00-20:00",
    "location": {
      "latitude": 22.296592,
      "longitude": 114.238758
    },
    "source": "api_tc",
    "quality_flags": [
      {
        "type": "SOURCE_TC_EN_BUSINESS_HOURS_CONFLICT",
        "severity": "warning",
        "fields": [
          "business_hours",
          "business_hours_en"
        ],
        "details": {
          "tc": "周一至周五,11:00-21:00;周日及公眾假期,12:00-20:00; 周六, 12:00-20:00",
          "en": "Mon to Fri 10:00-21:00; Sun & Public Holidays 12:00-20:00; Sat 12:00-20:00"
        }
      }
    ],
    "provenance": {
      "name": "api_tc",
      "name_en": "api_en",
      "address": "api_tc",
      "address_en": "api_en",
      "district": "api_tc",
      "business_hours": "api_tc",
      "business_hours_en": "api_en"
    },
    "retrieved_at": "2026-10-26 11:46 (HKT UTC+8)"
  },
  {
    "id": "852BA",
    "code": "852BA",
    "type": "store",
    "type_name": "順豐站",
    "type_name_en": "SF Store",
    "name": "太子汝洲街順豐站",
    "name_en": "Yu Chau Street, Prince Edward",
    "region": "九龍",
    "region_en": "Kowloon",
    "district": "油尖旺區",
    "district_en": "Yau Tsim Mong District",
    "sub_district": "太子",
    "sub_district_en": "Prince Edward",
    "address": "香港油尖旺區太子汝州街58號地下*",
    "address_en": "G/F, 58 Yu Chau Street*,Prince Edward,Yau Tsim Mong District,Hong Kong",
    "telephone": "64635742",
    "business_hours": "周一至周六,09:00-20:00;周日及勞工假期,休息",
    "business_hours_en": "Mon to Sat 09:00-20:00; Sun & Statutory Holidays Closed",
    "location": {
      "latitude": 22.3268229,
      "longitude": 114.1657536
    },
    "source": "api_tc",
    "quality_flags": [],
    "provenance": {
      "name": "api_tc",
      "name_en": "api_en",
      "address": "api_tc",
      "address_en": "api_en",
      "district": "api_tc",
      "business_hours": "api_tc",
      "business_hours_en": "api_en"
    },
    "retrieved_at": "2026-10-26 11:46 (HKT UTC+8)"
  },
  {
    "id": "852BAL",
    "code": "852BAL",
    "type": "store",
    "type_name": "順豐站",
    "type_name_en": "SF Store",
    "name": "旺角富榮花園順豐站",
    "name_en": "Charming Garden, Mong Kok",
    "region": "九龍",
    "region_en": "Kowloon",
    "district": "油尖旺區",
    "district_en": "Yau Tsim Mong District",
    "sub_district": "旺角",
    "sub_district_en": "Mong Kok",
    "address": "香港油尖旺區旺角海庭道8號富榮花園2期地下38號鋪*",
    "address_en": "Shop 38, G/F, Charming Garden Phase 2, Hoi Wang Road*,Mong Kok,Yau Tsim Mong District,Hong Kong",